STT,Mô hình,Input,Văn bản,Nhãn đúng hoặc kết quả mong muốn,Kết quả mô hình dự đoán/sinh ra/truy hồi,F1,Lỗi thuộc loại nào,Nguyên nhân nghi ngờ,Hướng cải thiện
1,M1: BM25 + XLM-R Fine-tuned (Pipeline),Có bao nhiêu nhân viên của Công ty Đông Ấn sống sót quay trở về?,"Những nhà nghiên cứu kết luận rằng bệnh giang mai đã bị mang từ Tân Thế giới sang châu Âu sau chuyến hải hành của Colombo. Những nghiên cứu này cho rằng những người châu Âu có thể đang mang các vi khuẩn nhiệt đới không lây qua đường tình dục về nhà, tại đó các vi khuẩn đó đã đột biến thành một dạng nguy hiểm hơn trong điều kiện khác biệt ở châu Âu. Bệnh tật hồi đó thường dễ gây chết người hơn ngày nay. Bệnh giang mai là căn bệnh gây chết người chủ yếu ở châu Âu trong Thời kỳ Phục hưng. Đại dịch tả đầu tiên bắt đầu tại Bengal, sau đó đến năm 1820 đã lan ra khắp Ấn Độ. 10.000 binh lính Anh và vô số người Ấn đã chết trong đại dịch này. Từ năm 1736 đến 1834 chỉ có khoảng 10% nhân viên của Công ty Đông Ấn là sống sót để quay về được nhà. Waldemar Haffkine, người làm việc chủ yếu tại Ấn Độ, là nhà vi sinh đầu tiên phát triển và sử dụng vắc-xin bệnh tả và dịch hạch.",khoảng 10% nhân viên,khoảng 10%,0.6667,Mô hình học theo từ khóa bề mặt,Mô hình có xu hướng khớp các từ khóa bề mặt gần nhau mà chưa nắm bắt trọn vẹn ngữ pháp câu,Tối ưu cấu hình độ dài câu trả lời tối đa khi suy luận và tăng số lượng mẫu huấn luyện
2,M1: BM25 + XLM-R Fine-tuned (Pipeline),Canada có mối quan hệ gì với tổ chức NATO?,"Canada là một quốc gia phát triển và nằm trong số các quốc gia giàu có nhất trên thế giới, với thu nhập bình quân đầu người cao thứ tám toàn cầu, và chỉ số phát triển con người cao thứ 11. Canada được xếp vào hàng cao nhất trong các so sánh quốc tế về giáo dục, độ minh bạch của chính phủ, tự do dân sự, chất lượng sinh hoạt, và tự do kinh tế. Canada tham gia vào nhiều tổ chức quốc tế và liên chính phủ về kinh tế: G8, G20, Hiệp định Thương mại Tự do Bắc Mỹ, Diễn đàn Hợp tác Kinh tế châu Á - Thái Bình Dương. Canada là một thành viên của Tổ chức Hiệp ước Bắc Đại Tây Dương (NATO).",Canada là một thành viên của Tổ chức Hiệp ước Bắc Đại Tây Dương (NATO),Canada là một thành viên,0.5,Mô hình học theo từ khóa bề mặt,Mô hình trích xuất thiếu vế sau do tối ưu hóa hàm loss cắt biên sớm,Bổ sung dữ liệu huấn luyện tiếng Việt đa dạng cấu trúc để tăng độ chính xác biên
3,M1: BM25 + XLM-R Fine-tuned (Pipeline),Tổ chức Hindu Mahasabha có suy nghĩ gì về Gandhi?,"Ngày 30 tháng 1 năm 1948, trên đường đến một nơi thờ tụng, Gandhi bị bắn chết bởi Nathuram Godse tại tòa nhà Birla ở New Delhi. Godse là một môn đồ Ấn giáo cực đoan được người đương thời cho là có mối quan hệ với cánh cực hữu của các tổ chức Ấn Độ giáo như Hindu Mahasabha. Tổ chức này cho Gandhi là người chịu trách nhiệm cho việc chính quyền suy nhược vì đã khăng khăng bắt buộc nộp một khoản tiền cho Pakistan. Godse và người cùng âm mưu là Narayan Apte sau bị đưa ra tòa kết án, và bị xử tử ngày 15 tháng 11 năm 1949. Vinayak Damodar Savarkar, chủ tịch của Hindu Mahasabha, một nhà cách mạng và môn đồ Ấn giáo cực đoan bị tố cáo là người nắm đầu dây của mưu đồ này, nhưng sau được giải tội vì thiếu bằng chứng.",Gandhi là người chịu trách nhiệm cho việc chính quyền suy nhược,người chịu trách nhiệm cho việc chính quyền suy nhược vì đã khăng khăng bắt buộc nộp một khoản tiền cho Pakistan.,0.5882,Mô hình học theo từ khóa bề mặt,Chọn gần đúng nhưng chưa trọn vẹn ngữ pháp do cơ chế Attention bị phân tán,Bổ sung dữ liệu huấn luyện tiếng Việt đa dạng cấu trúc để tăng độ chính xác biên
4,M1: BM25 + XLM-R Fine-tuned (Pipeline),Tại sao Ottoman rơi vào loạn lạc?,"Việc Bayezid bị bắt làm cho đất nước rơi vào loạn lạc. Từ năm 1402 đến 1413, nội chiến bùng nổ giữa các con của Bayezit. Cuộc chiến này kết thúc khi vua Mehmed I lên ngôi và xây dựng lại đất nước, kết thúc Thời kì đứt quãng của Đế quốc Ottoman. Cháu nội ông, Mehmed II đã tái cấu trúc của cả nhà nước lẫn quân đội, và đã thể hiện các kỹ năng quân sự của mình trong cuộc chiếm đóng Constantinople vào ngày 29 tháng 5 năm 1453, khi mới 21 tuổi. Thành phố này trở thành kinh đô mới của Đế quốc Ottoman, và Mehmed II xưng làm Kayser-i Rum (Hoàng đế La Mã). Dù vậy, ngôi Hoàng đế La Mã của sultan Ottoman không được người Hy Lạp và các nước phương Tây công nhận, và các Nga hoàng cũng tự phong cho mình chức vị này. Để nắm vững ngôi Hoàng đế La Mã, Mehmed II khao khát chiếm Roma, và cho quân xâm lược bán đảo Ý, chiếm Otranto và Apulia ngày 28 tháng 7, 1480. Nhưng sau khi ông bị ám sát ngày 5 tháng 3, 1481, chiến dịch ở Ý thất bại và quân Ottoman rút lui về.",Việc Bayezid bị bắt làm cho đất nước rơi vào loạn lạc,Việc Bayezid bị bắt,0.5,Mô hình học theo từ khóa bề mặt,Mô hình trích xuất thiếu vế kết quả của cụm từ nguyên nhân,Tối ưu cấu hình độ dài câu trả lời tối đa khi suy luận và tăng số lượng mẫu huấn luyện
5,M1: BM25 + XLM-R Fine-tuned (Pipeline),Vì nguyên nhân nào mà Ả Rập Xê Út cố gắng cải cách nền giáo dục?,"Các tiếp cận trong hệ thống giáo dục Ả Rập Xê Út bị cáo buộc là khuyến khích chủ nghĩa khủng bố Hồi giáo, dẫn đến các nỗ lực cải cách. Sau các vụ tấn công ngày 11 tháng 9 năm 2001, chính phủ đặt mục tiêu giải quyết hai vấn đề là khuyến khích chủ nghĩa cực đoan và giáo dục đại học không tương thích với kinh tế hiện đại, bằng cách hiện đại hoá với tốc độ châm hệ thống giáo dục thông qua chương trình cải cách ""Tatweer"". Chương trình Tatweer được tường thuật là có ngân sách khoảng 2 tỷ USD và tập trung vào việc chuyển đổi việc giảng dạy ra khỏi phương thức truyền thống là học thuộc lòng và học vẹt để hướng đến khuyến khích sinh viên phân tích và giải quyết vấn đề. Nó cũng đặt mục tiêu lập ra một hệ thống giáo dục cung cấp đào tạo có nền tảng thế tục và nghề nghiệp hơn.",hệ thống giáo dục Ả Rập Xê Út bị cáo buộc là khuyến khích chủ nghĩa khủng bố Hồi giáo,"khuyến khích chủ nghĩa khủng bố Hồi giáo,",0.5714,"Từ viết tắt, tiếng lóng, sai chính tả","Ngữ cảnh chứa lỗi chính tả (từ ""chậm"" viết sai thành ""châm"") và dấu phẩy thừa làm mô hình dự báo sai lệch biên câu trả lời",Lọc và chuẩn hóa dữ liệu tốt hơn ở bước tiền xử lý
6,M1: BM25 + XLM-R Fine-tuned (Pipeline),Ca sĩ nào hát bài chạy ngay đi,"Rất nhiều âm nhạc được ghi lại bởi ca sĩ-ca như Diana Ross, James Taylor, Carly Simon, Carole King và Janis Ian có nhiều hơn, nếu không nhiều hơn, phát sóng trên định dạng này hơn là trên 40 trạm hàng...",Sơn Tùng M-TP,"Diana Ross,",0.0,Nhãn mơ hồ,"Ranh giới đáp án bị nhập nhằng giữa việc lấy kèm danh xưng ""ông"" hay chỉ lấy tên riêng","Xây dựng bộ quy tắc hậu xử lý để loại bỏ các danh xưng thông dụng (ông, bà, Đại tướng...)"
7,M1: BM25 + XLM-R Fine-tuned (Pipeline),Con gái của Hồ Việt Trung,Hồ Việt Trung bên con gái Gia Hân ( tên ở nhà là Xí Muội ) trong tiệc mừng sinh nhật 3 tuổi của bé .,Xí Muội,Gia Hân,0.0,Nhãn mơ hồ,"Nhãn gốc chỉ lấy tên riêng nhưng mô hình lấy kèm danh từ chỉ chức danh ""vua""","Xây dựng bộ quy tắc hậu xử lý để loại bỏ các danh xưng thông dụng (ông, bà, Đại tướng...)"
8,M1: BM25 + XLM-R Fine-tuned (Pipeline),vợ của Võ Nguyên Giáp là ai,Do các đảng phái đối lập phản đối nên Hồ Chí Minh đồng ý loại Võ Nguyên Giáp và Trần Huy Liệu ra khỏi nội các. Các bên tổ chức Hội nghị và họp nhiều lần để thảo luận ai sẽ nắm giữ chức Bộ trưởng Quốc ...,Nguyễn Thị Quang Thái,Trần Huy Liệu,0.0,Với tìm kiếm: truy vấn và tài liệu dùng từ khác nhau nhưng cùng nghĩa,Từ khóa truy vấn và tài liệu dùng các từ đồng nghĩa/khác nhau khiến BM25 trả về ngữ cảnh sai hoàn toàn,Nâng cấp bộ truy hồi lên tìm kiếm ngữ nghĩa (Semantic Search/DPR) sử dụng mô hình ngôn ngữ
9,M1: BM25 + XLM-R Fine-tuned (Pipeline),Ai là chủ biên cuốn sách Những dấu vết thời đại đồng thau,"Tesla đã viết một số cuốn sách và bài viết cho tạp chí và tạp chí. Trong số những cuốn sách của anh ấy là những phát minh của tôi: Tự truyện của Nikola Tesla, biên soạn và chỉnh sửa bởi Ben Johnston; ...","Lê Văn Lan , Phạm Văn Kỉnh , Nguyễn Linh",Ben Johnston;,0.0,Nhãn mơ hồ,"Ngữ cảnh chứa nhiều tên gọi khác nhau của cùng một người (""Gia Hân"" và ""Xí Muội""), nhãn chỉ gán 1 trong 2 gây ra sự mơ hồ",Chuẩn hóa nhãn hoặc huấn luyện mô hình để chấp nhận nhiều đáp án thay thế
10,M1: BM25 + XLM-R Fine-tuned (Pipeline),Tổng thống Ba Lan là ai,"Ý kiến nói chuyến thăm của Tổng thống Ba Lan Andrzej Duda "" đã kết thúc tốt đẹp "" nhưng cộng đồng người Việt ở Ba Lan sẽ có tương lai thế nào vẫn luôn là câu hỏi hóc búa .",Lech Kaczynski,Andrzej Duda,0.0,Với tìm kiếm: truy vấn và tài liệu dùng từ khác nhau nhưng cùng nghĩa,"BM25 không tìm thấy tài liệu chứa đáp án, trả về tài liệu nhiễu chỉ chứa từ khóa ""Võ Nguyên Giáp""",Nâng cấp bộ truy hồi lên tìm kiếm ngữ nghĩa (Semantic Search/DPR) sử dụng mô hình ngôn ngữ
11,M1: BM25 + XLM-R Fine-tuned (Pipeline),Bộ trưởng bộ quốc phòng Việt Nam là ai,"- Chiều 9/1 , tại Trụ sở Bộ Tư lệnh Quân khu 5 , Đại tướng Ngô Xuân Lịch , Uỷ viên Bộ Chính trị , Phó Bí thư Quân uỷ Trung ương , Bộ trưởng Bộ Quốc phòng Việt Nam chủ trì lễ đón chính thức Đại tướng Tia Banh , Uỷ viên Thường vụ Đảng Nhân dân Campuchia , Phó Thủ tướng Chính phủ , Bộ trưởng Bộ Quốc phòng dẫn đầu Đoàn Đại biểu Quân sự cấp cao Campuchia thăm chính thức nước ta từ ngày 8 - 11/1 .",Ngô Xuân Lịch,Đại tướng Ngô Xuân Lịch,0.75,Nhãn mơ hồ,"Nhập nhằng danh xưng quân hàm ""Đại tướng""","Xây dựng bộ quy tắc hậu xử lý để loại bỏ các danh xưng thông dụng (ông, bà, Đại tướng...)"
12,M1: BM25 + XLM-R Fine-tuned (Pipeline),Vận động viên nào giành huy chương vàng Olympic 2012 môn quần vợt đơn nam?,Hãy nghe Andy Murray ( sau khi vô địch Wimbledon 2016 ) nói về Thế vận hội 2016 ở Rio : “ Tôi rất vui khi có mặt ở hai kỳ Thế vận hội liên tiếp ( Murray giành HCV đơn nam Thế vận hội 2012 ) . Rio rõ ràng là một mục tiêu lớn của tôi và hy vọng tôi có thể chơi tốt ở đó ” .,Murray,Andy Murray,0.6667,Nhãn mơ hồ,Nhập nhằng giữa họ (Murray) và cả họ tên (Andy Murray),"Xây dựng bộ quy tắc hậu xử lý để loại bỏ các danh xưng thông dụng (ông, bà, Đại tướng...)"
13,M1: BM25 + XLM-R Fine-tuned (Pipeline),Vị vua nào sau đây đã đổi quốc hiệu nước ta thành Đại Nam?,Mộc bản nói về Dụ của vua Minh Mạng cho đổi quốc hiệu từ Việt Nam thành Đại Nam .,Minh Mạng,Dụ của vua Minh Mạng,0.5714,Nhãn mơ hồ,Nhập nhằng ranh giới thực thể chỉ tên người và cụm danh từ sở hữu,"Xây dựng bộ quy tắc hậu xử lý để loại bỏ các danh xưng thông dụng (ông, bà, Đại tướng...)"
14,M1: BM25 + XLM-R Fine-tuned (Pipeline),"Khi người châu Âu đặt chân vào Canada, thì dân số của người bản địa là bao nhiêu?","Vào thời điểm người châu Âu thiết lập các khu định cư đầu tiên, dân số thổ dân Canada được ước tính là từ 200.000 đến hai triệu, còn Uỷ ban Hoàng gia Canada về Sức khỏe Thổ dân chấp nhận con số 500.000. Do hậu quả từ quá trình thực dân hóa của người châu Âu, các dân tộc Thổ dân Canada phải chịu tổn thất do các dịch bệnh truyền nhiễm mới được đưa đến bùng phát lặp lại nhiều lần, như dịch cúm, dịch sởi, dịch đầu mùa (do Thổ dân không có miễn dịch tự nhiên), kết quả là dân số của họ giảm từ 40-80% trong các thế kỷ sau khi người châu Âu đến. Các dân tộc Thổ dân tại Canada ngày nay gồm có Các dân tộc Trước tiên (First Nations), Inuit, và Métis. Người Métis là một dân tộc hỗn huyết, họ hình thành từ thế kỷ XVII khi những người Dân tộc Trước tiên và người Inuit kết hôn với dân định cư người châu Âu. Nhìn chung, người Inuit có ảnh hưởng tương hỗ hạn chế hơn với người châu Âu định cư trong thời kỳ thuộc địa hóa.",200.000 đến hai triệu,"từ 200.000 đến hai triệu,",0.8889,Nhãn mơ hồ,"Nhãn gốc không đồng nhất về việc lấy kèm giới từ ""từ"" và dấu phẩy kết thúc",Lọc và chuẩn hóa dữ liệu tốt hơn ở bước tiền xử lý
15,M1: BM25 + XLM-R Fine-tuned (Pipeline),Ai là ông tổ nghề thêu Việt Nam ?,"Nhiều người lầm tưởng ông tổ nghề thêu của Việt Nam là ông Trần Quốc Khái nhưng những văn bia , sắc phong hiện còn lưu giữ ở Văn Miếu - Quốc Tử Giám và đình Đào Xá , xã Thắng Lợi ( Thường Tín - Hà Nội ) lại minh chứng , đó là Lê Công Hành .",Lê Công Hành,Trần Quốc Khái,0.0,"Mô hình không hiểu phủ định, mỉa mai, so sánh hoặc ngữ cảnh","Mô hình không hiểu cấu trúc tương phản/phủ định giả định (""nhiều người lầm tưởng X... nhưng thực chất là Y"")",Tăng chiều dài ngữ cảnh tối đa (max_seq_length) khi huấn luyện và cải thiện độ sâu ngữ nghĩa
16,M1: BM25 + XLM-R Fine-tuned (Pipeline),"Trong thần thoại Hy Lạp, vị thần khổng lồ có tên là gì?","Các thần khổng lồ Titans khởi thuỷ bao gồm 12 người gắn liền với rất nhiều khái niệm như đại dương , trí nhớ , tầm nhìn và quy luật tự nhiên ; sau đó , họ lại sinh ra các thần Titans khác , như là Prometheus ( Προμηθεύς ) và Atlas ( Ἄτλας ) . Họ được dẫn dắt bởi vị thần trẻ nhất trong các vị thần thuộc thế hệ đầu tiên , Cronus ( Κρόνος ) , người đã lật đổ cha mình là Uranus ( Ουρανος , hay "" bầu trời "" ) , với sự hỗ trợ của mẹ là Gaia ( Γαία , hay "" quả đất "" ) . Các thần khổng lồ Titan cuối cùng lại bị các vị thần trên đỉnh Olympus , dẫn đầu là Zeus , soán ngôi trong Titanomachy ( "" Cuộc chiến với các thần khổng lồ Titan "" ) , và rất nhiều người trong số họ đã bị cầm tù tại Tartarus ( Ταρταρος ) , tận cùng của địa ngục .",Titans,Cronus,0.0,"Mô hình không hiểu phủ định, mỉa mai, so sánh hoặc ngữ cảnh","Ngữ cảnh dài chứa nhiều thực thể thần thoại đan xen, mô hình chọn nhầm thực thể dẫn đầu thay vì tên nhóm thần",Tăng chiều dài ngữ cảnh tối đa (max_seq_length) khi huấn luyện và cải thiện độ sâu ngữ nghĩa
17,M1: BM25 + XLM-R Fine-tuned (Pipeline),Vì sao những nông dân Texas bỏ làm nông nghiệp mà làm cho các công việc phục vụ chiến tranh?,"Chiến tranh thế giới thứ hai có tác động đáng kể đến Texas, liên bang đổ tiền vào việc xây dựng các căn cứ quân sự, các nhà máy vũ khí, các trại giam giữ tù binh chiến tranh và viện quân y; 750.000 thanh niên ở lại phục vụ; các thành phố bùng nổ với ngành công nghiệp mới, các cơ sở bậc đại học nắm giữ các vai trò mới; và hàng trăm nghìn nông dân nghèo rời đi để tìm kiếm các công việc phục vụ chiến tranh với mức lương cao hơn, và họ không bao giờ còn quay trở lại làm nông nghiệp. Texas chế tạo ra 3,1 phần trăm tổng số quân giới do Hoa Kỳ sản xuất trong Chiến tranh thế giới thứ hai, xếp hạng thứ 11 trong số 48 tiểu bang đương thời.",mức lương cao hơn,"để tìm kiếm các công việc phục vụ chiến tranh với mức lương cao hơn,",0.4211,"Mô hình không hiểu phủ định, mỉa mai, so sánh hoặc ngữ cảnh","Mô hình bị bối rối trước câu hỏi nguyên nhân ""Vì sao"" và trích xuất cả cụm chỉ mục đích ""để...""",Cải thiện khả năng hiểu ngữ cảnh của model
18,M1: BM25 + XLM-R Fine-tuned (Pipeline),Các đạo luật lớn nào cũng được Quốc hội Hoa Kỳ lần thứ 111 thông qua và được Obama ký thành luật?,"Ngoài việc đối phó với khủng hoảng kinh tế, Quốc hội Hoa Kỳ lần thứ 111 thông qua các đạo luật lớn như Đạo luật Bảo hiểm Y tế Đại chúng và Bảo vệ Bệnh nhân, Đạo luật Bảo vệ Giới tiêu dùng và Cãi cách Phố Wall Dodd-Frank và Đạo luật Bãi bỏ Chính sách Đứng hỏi, Đừng kể (ghi chú dịch thuật: người đồng tính giờ đây có thể công khai giới tính khi phục vụ quân đội mà không phải giấu giếm dưới chính sách ""đừng hỏi"" và ""đừng kể"" của quân đội trước đó). Tất cả các đạo luật này được tổng thống Obama ký thành luật. Sau bầu cử giữa kỳ vào năm 2010 mà trong đó đảng Cộng hòa kiểm soát được Hạ viện và đảng Dân chủ kiểm soát được Thượng viện, Quốc hội Hoa Kỳ trải qua một thời kỳ bế tắc cao độ và tranh cãi sôi động về vấn đề có nên hay không tăng trần nợ công, nới rộng thêm thời gia giảm thuế cho công dân có thu nhập trên 250.000 Đô la Mỹ một năm và nhiều vấn đề then chốt khác nữa. Các cuộc tranh cãi đang tiếp tục này dẫn đến việc tổng thống Obama ký Đạo luật Kiểm soát Ngân sách 2011 và Đạo luật Cứu trợ Người đóng thuế Mỹ 2012 - kết quả là việc cắt giảm tạm thời ngân sách có hiệu lực vào tháng 3 năm 2013 - cũng như tăng thuế, chủ yếu đánh vào người giàu. Hậu quả từ sự bất mãn của công chúng gia tăng đối với cả hai đảng tại Quốc hội trong thời kỳ này là tỉ lệ chấp thuận dành cho quốc hội rơi xuống mức trung bình 15% ủng hộ trong các cuộc thăm dò công chúng của viện Gallup từ năm 2012-13, đây là tỉ lệ thấp nhất được ghi nhận và dưới cả mức trung bình 33% tính từ năm 1974 đến 2013.","Đạo luật Bảo hiểm Y tế Đại chúng và Bảo vệ Bệnh nhân, Đạo luật Bảo vệ Giới tiêu dùng và Cãi cách Phố Wall Dodd-Frank và Đạo luật Bãi bỏ Chính sách Đứng hỏi, Đừng kể",Đạo luật Kiểm soát Ngân sách 2011 và Đạo luật Cứu trợ Người đóng thuế Mỹ 2012,0.2222,"Từ viết tắt, tiếng lóng, sai chính tả","Ngữ cảnh chứa nhiều lỗi dịch thuật và chính tả (như ""Cãi cách"", ""Đứng hỏi""), kết hợp ngữ cảnh dài gây nhiễu Attention",Lọc và chuẩn hóa dữ liệu tốt hơn ở bước tiền xử lý
19,M1: BM25 + XLM-R Fine-tuned (Pipeline),JAXA đã thiết kế và chế tạo tàu nào?,"Cơ quan nghiên cứu và phát triển hàng không vũ trụ Nhật Bản (JAXA) đã thiết kế và chế tạo một tàu quỹ đạo, Akatsuki (tên gọi cũ ""Hành tinh-C""), phóng lên ngày 20 tháng 5 năm 2010, nhưng nó đã thất bại khi không đi vào quỹ đạo Sao Kim tháng 12 năm 2010. Hy vọng vẫn còn khi các kĩ sư đặt con tàu vào chế độ đóng băng và họ cố gắng thử đưa tàu vào quỹ đạo một lần nữa vào năm 2016. Nhiệm vụ nghiên cứu của nó bao gồm chụp ảnh bề mặt bằng một camera hồng ngoại và phát hiện ra tia sét trong khí quyển, cũng như phát hiện ra những núi lửa còn khả năng hoạt động.",Akatsuki,"tàu quỹ đạo,",0.0,"Mô hình không hiểu phủ định, mỉa mai, so sánh hoặc ngữ cảnh","Mô hình không phân biệt được danh từ chung chỉ loại tàu (""tàu quỹ đạo"") và danh từ riêng chỉ tên tàu (""Akatsuki"")",Tăng chiều dài ngữ cảnh tối đa (max_seq_length) khi huấn luyện và cải thiện độ sâu ngữ nghĩa
